organization,homepage,donate_url,one_time,monthly,community_model,legacy,stock_daf_qcd,crypto,corporate_or_campaign,notes
Ocean Conservancy,https://oceanconservancy.org/,https://oceanconservancy.org/,yes,yes,supporter actions + fundraising toolkit + major donor circle,yes,yes,yes,yes,one-time/monthly form on homepage; fundraising pages; crypto via The Giving Block; Champions for Sea Change; legacy and real estate options
Oceana,https://oceana.org/waystogive,https://oceana.org/waystogive,yes,yes,membership + monthly + wedding/tribute options,limited,not explicit on page,not explicit on page,not explicit on page,monthly community called Join the Tide; any amount makes you a member; tribute and wedding options
Surfrider Foundation,https://www.surfrider.org/donate,https://www.surfrider.org/join,yes,yes,membership + fundraiser + check,not shown on primary pages,not shown on primary pages,yes,not explicit on primary pages,"donation of $5+ creates membership; card, ACH, Apple Pay, Google Pay, PayPal, Venmo; crypto and fundraising listed"
The Ocean Cleanup,https://theoceancleanup.com/donate/,https://theoceancleanup.com/donate/,yes,yes,honor gift + company donation field,not highlighted on donate page,not highlighted on donate page,not shown,yes,"one-time or monthly, USD/EUR switching, tribute and company donations"
Mission Blue,https://missionblue.org/invest-new/,https://missionblue.org/invest-new/,yes,yes,Blue Circle + special campaign + memorial,yes,not detailed on invest page,not shown,yes,"recurring donations, commemorative gifts, Blue Circle, Legacy Society and campaigns"
Coral Reef Alliance,https://coral.org/en/impact/,https://coral.org/en/donate/other/,yes,yes,matching + fundraiser + in honor/in memory,yes,yes,not shown,yes,"direct donation plus DAF, stock, QCD, planned giving, matching and online fundraisers"
Reef Check,https://www.reefcheck.org/donate/,https://www.reefcheck.org/donate/,yes,yes,membership + adopt-a-reef + corporate sponsorship,yes,yes,not shown,yes,"membership, monthly gifts, Adopt-a-Reef, sponsorship, IRA rollover, stock, bequests and vehicle donation"
Oceanic Society,https://www.oceanicsociety.org/donate/,https://www.oceanicsociety.org/donate/,yes,yes,membership + animal adoption + travel + fundraiser,yes,yes,yes,yes,"membership from $5/month, adoption, expeditions, merchandise, legacy, corporate giving, fundraising, crypto and stock"
